{
	"version": "1.0",
	"privacy": "public open",
	"licenses": [
		{
			"name": "to be determined"
		}
	],
	"identifier": {
		"identifier" : "1KGP"
	},
	"creators": [
		{
			"name": "1000 Genomes Project"
		}
	],
	"types": [
		{
			"information": {
				"value": "genomics"
			}
		}
	],
	"title": "1000 Genomes Project",
	"storedIn": {
		"name" : "canadian Centre for Computational Genomics"
	},
	"primaryPublications" : [
		{
			"identifier": {
				"identifier": "https://doi.org/10.1038/nature15393"
			},
			"title": "A global reference for human genetic variation",
			"dates": [
				{
					"type": {
						"value":"Primary reference publication date"
					},
					"date": "01 october 2015"
				}
			],
			"authors": [
				{
				"name":"1000 Genomes Project"
				}
			]
		}
	],
	"isAbout": [
		{
			"identifier": {
				"identifier": "9606",
				"identifierSource":"https://www.ncbi.nlm.nih.gov/taxonomy/9606"
			},
			"name":"Homo sapiens"
		}
	],
	"dates": [
		{
			"type": {
				"value":"CONP DATS JSON fileset creation date"
			},
			"date": "2019-04-09 14:44:57"
		}
	],
	"hasPart": [
		{
			"identifier": {
				"identifier": "1KGP_chr1.json"
			},
			"title":"Chromosome 1",
			"creators": [
				{
					"name": "1000 Genomes Project"
				}
			],
			"types": [
				{
					"information": {
						"value": "genomics"
					}
				}
			]
		},
		{
			"identifier": {
				"identifier": "1KGP_chr10.json"
			},
			"title":"Chromosome 10",
			"creators": [
				{
					"name": "1000 Genomes Project"
				}
			],
			"types": [
				{
					"information": {
						"value": "genomics"
					}
				}
			]
		},
		{
			"identifier": {
				"identifier": "1KGP_chr11.json"
			},
			"title":"Chromosome 11",
			"creators": [
				{
					"name": "1000 Genomes Project"
				}
			],
			"types": [
				{
					"information": {
						"value": "genomics"
					}
				}
			]
		},
		{
			"identifier": {
				"identifier": "1KGP_chr12.json"
			},
			"title":"Chromosome 12",
			"creators": [
				{
					"name": "1000 Genomes Project"
				}
			],
			"types": [
				{
					"information": {
						"value": "genomics"
					}
				}
			]
		},
		{
			"identifier": {
				"identifier": "1KGP_chr13.json"
			},
			"title":"Chromosome 13",
			"creators": [
				{
					"name": "1000 Genomes Project"
				}
			],
			"types": [
				{
					"information": {
						"value": "genomics"
					}
				}
			]
		},
		{
			"identifier": {
				"identifier": "1KGP_chr14.json"
			},
			"title":"Chromosome 14",
			"creators": [
				{
					"name": "1000 Genomes Project"
				}
			],
			"types": [
				{
					"information": {
						"value": "genomics"
					}
				}
			]
		},
		{
			"identifier": {
				"identifier": "1KGP_chr15.json"
			},
			"title":"Chromosome 15",
			"creators": [
				{
					"name": "1000 Genomes Project"
				}
			],
			"types": [
				{
					"information": {
						"value": "genomics"
					}
				}
			]
		},
		{
			"identifier": {
				"identifier": "1KGP_chr16.json"
			},
			"title":"Chromosome 16",
			"creators": [
				{
					"name": "1000 Genomes Project"
				}
			],
			"types": [
				{
					"information": {
						"value": "genomics"
					}
				}
			]
		},
		{
			"identifier": {
				"identifier": "1KGP_chr17.json"
			},
			"title":"Chromosome 17",
			"creators": [
				{
					"name": "1000 Genomes Project"
				}
			],
			"types": [
				{
					"information": {
						"value": "genomics"
					}
				}
			]
		},
		{
			"identifier": {
				"identifier": "1KGP_chr18.json"
			},
			"title":"Chromosome 18",
			"creators": [
				{
					"name": "1000 Genomes Project"
				}
			],
			"types": [
				{
					"information": {
						"value": "genomics"
					}
				}
			]
		},
		{
			"identifier": {
				"identifier": "1KGP_chr19.json"
			},
			"title":"Chromosome 19",
			"creators": [
				{
					"name": "1000 Genomes Project"
				}
			],
			"types": [
				{
					"information": {
						"value": "genomics"
					}
				}
			]
		},
		{
			"identifier": {
				"identifier": "1KGP_chr2.json"
			},
			"title":"Chromosome 2",
			"creators": [
				{
					"name": "1000 Genomes Project"
				}
			],
			"types": [
				{
					"information": {
						"value": "genomics"
					}
				}
			]
		},
		{
			"identifier": {
				"identifier": "1KGP_chr20.json"
			},
			"title":"Chromosome 20",
			"creators": [
				{
					"name": "1000 Genomes Project"
				}
			],
			"types": [
				{
					"information": {
						"value": "genomics"
					}
				}
			]
		},
		{
			"identifier": {
				"identifier": "1KGP_chr21.json"
			},
			"title":"Chromosome 21",
			"creators": [
				{
					"name": "1000 Genomes Project"
				}
			],
			"types": [
				{
					"information": {
						"value": "genomics"
					}
				}
			]
		},
		{
			"identifier": {
				"identifier": "1KGP_chr22.json"
			},
			"title":"Chromosome 22",
			"creators": [
				{
					"name": "1000 Genomes Project"
				}
			],
			"types": [
				{
					"information": {
						"value": "genomics"
					}
				}
			]
		},
		{
			"identifier": {
				"identifier": "1KGP_chr3.json"
			},
			"title":"Chromosome 3",
			"creators": [
				{
					"name": "1000 Genomes Project"
				}
			],
			"types": [
				{
					"information": {
						"value": "genomics"
					}
				}
			]
		},
		{
			"identifier": {
				"identifier": "1KGP_chr4.json"
			},
			"title":"Chromosome 4",
			"creators": [
				{
					"name": "1000 Genomes Project"
				}
			],
			"types": [
				{
					"information": {
						"value": "genomics"
					}
				}
			]
		},
		{
			"identifier": {
				"identifier": "1KGP_chr5.json"
			},
			"title":"Chromosome 5",
			"creators": [
				{
					"name": "1000 Genomes Project"
				}
			],
			"types": [
				{
					"information": {
						"value": "genomics"
					}
				}
			]
		},
		{
			"identifier": {
				"identifier": "1KGP_chr6.json"
			},
			"title":"Chromosome 6",
			"creators": [
				{
					"name": "1000 Genomes Project"
				}
			],
			"types": [
				{
					"information": {
						"value": "genomics"
					}
				}
			]
		},
		{
			"identifier": {
				"identifier": "1KGP_chr7.json"
			},
			"title":"Chromosome 7",
			"creators": [
				{
					"name": "1000 Genomes Project"
				}
			],
			"types": [
				{
					"information": {
						"value": "genomics"
					}
				}
			]
		},
		{
			"identifier": {
				"identifier": "1KGP_chr8.json"
			},
			"title":"Chromosome 8",
			"creators": [
				{
					"name": "1000 Genomes Project"
				}
			],
			"types": [
				{
					"information": {
						"value": "genomics"
					}
				}
			]
		},
		{
			"identifier": {
				"identifier": "1KGP_chr9.json"
			},
			"title":"Chromosome 9",
			"creators": [
				{
					"name": "1000 Genomes Project"
				}
			],
			"types": [
				{
					"information": {
						"value": "genomics"
					}
				}
			]
		},
		{
			"identifier": {
				"identifier": "1KGP_chrMT.json"
			},
			"title":"Mitochondrial genome",
			"creators": [
				{
					"name": "1000 Genomes Project"
				}
			],
			"types": [
				{
					"information": {
						"value": "genomics"
					}
				}
			]
		},
		{
			"identifier": {
				"identifier": "1KGP_chrX.json"
			},
			"title":"Chromosome X",
			"creators": [
				{
					"name": "1000 Genomes Project"
				}
			],
			"types": [
				{
					"information": {
						"value": "genomics"
					}
				}
			]
		},
		{
			"identifier": {
				"identifier": "1KGP_chrY.json"
			},
			"title":"Chromosome Y",
			"creators": [
				{
					"name": "1000 Genomes Project"
				}
			],
			"types": [
				{
					"information": {
						"value": "genomics"
					}
				}
			]
		}
	]
}
