{
	"version": "1.0",
	"privacy": "public open",
	"licenses": [
		{
			"name": "to be determined"
		}
	],
	"identifier": {
		"identifier": "1KGP_DATS_chrMT"
	},
	"title":"Mitochondrial genome",
	"dates": [
		{
			"type": {
				"value":"source .vcf file creation date"
			},
			"date": "2015-10-02 00:00:00"
		}
	],
	"types": [
		{
			"information": {
				"value": "genomics"
			}
		}
	],
	"storedIn": {
		"name": "https://datahub-khvul4ng.udes.genap.ca/ALL.chrMT.phase3_callmom-v0_4.20130502.genotypes.vcf.gz",
		"description": "Gzipped .vcf file containing sequence variations"
	},
	"dimensions": [
		{
			"name": {
				"value": "Count of Single Nucleotide Polymorphism variants"
			},
			"values": [
				"3587"
			]
		},
		{
			"name": {
				"value": "Count of single-nucleotide insertion and deletion events"
			},
			"values": [
				"20"
			]
		}
	],
	"creators": [
		{
			"name": "1000 Genomes Project"
		}
	],
	"extraProperties": [
		{
			"category": "FTP link to gzipped FASTA file containing reference DNA sequence",
			"values": [
				{
					"value": ""
				}
			]
		}
	]
}
