{
	"version": "1.0",
	"privacy": "public open",
	"licenses": [
		{
			"name": "to be determined"
		}
	],
	"identifier": {
		"identifier": "9483_refseq"
	},
	"title":"Callithrix jacchus reference genome",
	"dates": [
		{
			"type": {
				"value":"reference data download date"
			},
			"date": "2019-04-16 12:42:04"
		}
	],
	"types": [
		{
			"information": {
				"value": "genomics"
			}
		}
	],
	"storedIn": {
		"name": "https://www.ncbi.nlm.nih.gov/genome/442?genome_assembly_id=300134",
		"description": "NCBI page describing reference genome"
	},
	"dimensions": [
		{
			"name": {
				"value": "Size of genome (in Mb)"
			},
			"values": [
				"2914.96"
			]
		},
		{
			"name": {
				"value": "Percentage of genome composed of guanine/cytosine"
			},
			"values": [
				"41.3414"
			]
		},
		{
			"name": {
				"value": "Number of identified protein-encoding genes in genome"
			},
			"values": [
				"45251"
			]
		}
	],
	"creators": [
		{
			"name": "Washington University"
		}
	],
	"extraProperties": [
		{
			"category": "FTP link to FASTA file containing DNA sequence",
			"values": [
				{
					"value": "ftp://ftp.ncbi.nlm.nih.gov/genomes/refseq/vertebrate_mammalian/Callithrix_jacchus/latest_assembly_versions/GCF_000004665.1_Callithrix_jacchus-3.2/GCF_000004665.1_Callithrix_jacchus-3.2_genomic.fna.gz"
				}
			]
		},
		{
			"category": "FTP link to GFF file containing detailed annotations",
			"values": [
				{
					"value": "ftp://ftp.ncbi.nlm.nih.gov/genomes/refseq/vertebrate_mammalian/Callithrix_jacchus/latest_assembly_versions/GCF_000004665.1_Callithrix_jacchus-3.2/GCF_000004665.1_Callithrix_jacchus-3.2_genomic.gff.gz"
				}
			]
		}
	]
}
