{
	"version": "1.0",
	"privacy": "public open",
	"licenses": [
		{
			"name": "to be determined"
		}
	],
	"identifier": {
		"identifier": "1KGP_DATS_chr4"
	},
	"title":"Chromosome 4",
	"dates": [
		{
			"type": {
				"value":"source .vcf file creation date"
			},
			"date": "2015-02-18 00:00:00"
		}
	],
	"types": [
		{
			"information": {
				"value": "genomics"
			}
		}
	],
	"storedIn": {
		"name": "https://datahub-khvul4ng.udes.genap.ca/ALL.chr4.phase3_shapeit2_mvncall_integrated_v5a.20130502.genotypes.vcf.gz",
		"description": "Gzipped .vcf file containing sequence variations"
	},
	"dimensions": [
		{
			"name": {
				"value": "Count of Single Nucleotide Polymorphism variants"
			},
			"values": [
				"5430270"
			]
		},
		{
			"name": {
				"value": "Count of single-nucleotide insertion and deletion events"
			},
			"values": [
				"217157"
			]
		}
	],
	"creators": [
		{
			"name": "1000 Genomes Project"
		}
	],
	"extraProperties": [
		{
			"category": "FTP link to gzipped FASTA file containing reference DNA sequence",
			"values": [
				{
					"value": "ftp://ftp.1000genomes.ebi.ac.uk//vol1/ftp/technical/reference/phase2_reference_assembly_sequence/hs37d5.fa.gz"
				}
			]
		}
	]
}
